Question,Focus (Drug),Question Type,original_drug
how does rivatigmine and otc sleep medicine interact,Trimethoprim-sulfamethoxazole,Interaction,rivastigmine
how does Clarithromycin affect the brain,Clarithromycin,Action,Valium
what is Amoxicillin,Amoxicillin,Information,morphine
what are the milligrams for oxycodone e,Cefixime,Dose,oxycodone ER
81% aspirin contain resin and shellac in it. ?,Levofloxacin,Ingredient,aspirin 81 mg
what is Doxycycline used for,Doxycycline,Indication,desonide ointment
how soon can Cefuroxime be taken after a cocktail?,Cefuroxime,Interaction,Tylenol
Azithromycin how it works,Azithromycin,Action,Breo inhaler
Cefotaxime how it works,Cefotaxime,Usage,Breo inhaler
Ciprofloxacin 40mg what is it for,Ciprofloxacin,Indication,Qvar
does Nitrofurantoin ophthalmic helps for iritis?,Nitrofurantoin,Indication,cyclosporine
what ingredient in walnut interferes with Fosfomycin drug absorption,Fosfomycin,Interaction,Synthroid
what is the color of the fluvaastatin pill,Amoxicillin,Appearance,fluvastatin
"is penicillin in the pill ""Azithromycin?""",Azithromycin,Ingredient,montelukast
"can i take metamucil with ""Ciprofloxacin?""",Ciprofloxacin,Interaction,ciprofloxacin
how long before a meal should Levofloxacin be taken,Levofloxacin,Usage,Lansoprazole
what does using Cefixime make your face look like,Cefixime,Side effects,fluorouracil
why did my doctor give me level iracetam,Clarithromycin,Indication,Levetiracetam
results of stopping Nitrofurantoin?,Nitrofurantoin,Usage,terazosin
what Cefuroxime look like,Cefuroxime,Appearance,meloxicam
Ciprofloxacin how often,Ciprofloxacin,Usage,nitroglycerin
what is the maximum dose of Trimethoprim-sulfamethoxazole,Trimethoprim-sulfamethoxazole,Dose,pregabalin
Doxycycline when is it safe to take,Doxycycline,Interaction,neupro and ropinirole
Fosfomycin when is it safe to take,Fosfomycin,Comparison,neupro and ropinirole
what is Cefotaxime >65,Cefotaxime,Information,prevnar
how many mg does it take to overdose on Amoxicillin,Amoxicillin,Overdose,oxycodone
what medication not to take with Doxycycline,Doxycycline,Interaction,lithium
Fosfomycin drug/?,Fosfomycin,Information,MST
what size doses of Cefotaxime are available?,Cefotaxime,Dose,metformin
"Cefixime s9 orange how many ""grams?""",Cefixime,Dose,pravastatin
how long Azithromycin remains in body,Azithromycin,Action/time,morphine
"what is the imprint on metoprolol succ., 50 mg",Cefuroxime,Appearance,metoprolol succinate
what can take the place of Nitrofurantoin,Nitrofurantoin,Alternatives,tramadol
how to administer Clarithromycin,Clarithromycin,Usage,denosumab
what is Levofloxacin,Levofloxacin,Information,barbiturates
what are the inactive ingredients to the Ciprofloxacin,Ciprofloxacin,Ingredient,pneumonia vaccine
how to prep and administer Trimethoprim-sulfamethoxazole,Trimethoprim-sulfamethoxazole,Usage,insulin
"Levofloxacin "".25mg"" lowest dosage?",Levofloxacin,Dose,clonazepam
Cefixime treat uti?,Cefixime,Indication,Levaquin
sickness in humans caused Ciprofloxacin on toys from china?,Ciprofloxacin,Side effects,formaldehyde
is cyclobenzaprine a benzodiazepine?,Cefuroxime,Information,cyclobenzaprine | benzodiazepine
what drugs contain in Amoxicillin,Amoxicillin,Ingredient,estrone injection
can i eat after taking Nitrofurantoin?,Nitrofurantoin,Usage,Rapaflo
how much Cefotaxime is needed to treat hashimotos,Cefotaxime,Dose,levothyroxine
can i take tea with Azithromycin?,Azithromycin,Interaction,azithromycin
Trimethoprim-sulfamethoxazole 10 what is all in this pill is it safe,Trimethoprim-sulfamethoxazole,Ingredient,Vyvanse
Clarithromycin 10 what is all in this pill is it safe,Clarithromycin,Side effects,Vyvanse
what is a high level of Doxycycline,Doxycycline,not_drug_question,TrOOP
what is in Azithromycin,Azithromycin,Ingredient,Flomax
what is the class for Fosfomycin?,Fosfomycin,Information,insulin glargine
what medicines raise blood sugar,Trimethoprim-sulfamethoxazole,Action,medicines that raise blood sugar
what is metopol tar use,Nitrofurantoin,Indication,metoprolol tartrate
"does Levofloxacin cause i ""insomnia?""",Levofloxacin,Side effects,corticosteroids
how reduce cholesterol,Doxycycline,Indication,drugs that reduce cholesterol
"when is Clarithromycin ""contra indicated?""",Clarithromycin,Contraindication,Gardasil
what is the classification of Amoxicillin,Amoxicillin,Information,cromolyn
"i take Ciprofloxacin, my eyes are blurry, if i stop taking it, will my eyes clear up ?",Ciprofloxacin,Side effects,lorazepam
how to use Cefuroxime,Cefuroxime,Usage,thymol
is Cefotaxime a drug?,Cefotaxime,Information,zolpidem
Azithromycin can be the cause of elevated bun/ creatinine level?,Azithromycin,Side effects,mercaptopurine
when does skin redness start on Cefixime,Cefixime,Side effects,fluorouracil
how many mgs of Fosfomycin is recommended,Fosfomycin,Dose,colchicine
what tier drug is Cefixime,Cefixime,Information,methylphenidate
what is Cefuroxime,Cefuroxime,Information,normal saline
what is Nitrofurantoin for?- consider waiting for a new vaccine coming spring of 2018,Nitrofurantoin,Indication,Zostavax
what is Cefotaxime?,Cefotaxime,Information,Ciprodex
how often can i get a cortisone shot,Azithromycin,Usage/time,cortisone shots
why Doxycycline,Doxycycline,Indication,codeine
how to give Levofloxacin,Levofloxacin,Usage,Toradol IM
wean off Clarithromycin?,Clarithromycin,Stopping/tapering,Tegretol
can you take these tow medications at the same time of day Trimethoprim-sulfamethoxazole?,Trimethoprim-sulfamethoxazole,Interaction,Concerta and Lexapro
how long the trichomoniasis take to clear after i take the medicine,Ciprofloxacin,not_drug_question,trichomoniasis drugs
what happened if one takes a double does of Amoxicillin,Amoxicillin,Overdose,Simvastatin
what is antibiotic?,Fosfomycin,Information,Antibiotics
what kind of rash could Fosfomycin cause,Fosfomycin,Side effects,pravastatin
what is Doxycycline,Doxycycline,Information,ketorolac eye drops
how to take your medicine diabetes,Azithromycin,Usage,diabetes medicine
what mg Trimethoprim-sulfamethoxazole comes in,Trimethoprim-sulfamethoxazole,Dose,Norco
what type of drug is Nitrofurantoin,Nitrofurantoin,Information,ecstasy
what are the side effects of Cefuroxime,Cefuroxime,Side effects,valsartan
Ciprofloxacin capsules how supplied,Ciprofloxacin,Information,Keflex
what is nano silver?,Cefotaxime,Information,nanosilver
why to take Clarithromycin,Clarithromycin,Indication,Vicodin
how is Cefixime and amphetamine used,Cefixime,Usage,cocaine
how is cocaine and Levofloxacin used,Levofloxacin,Usage,amphetamine
what is classed as a low dose of Amoxicillin,Amoxicillin,Dose,azathioprine
what does Doxycycline contain. any aspirin?,Doxycycline,Ingredient,ibuprofen
how much time before Amoxicillin takes effect,Amoxicillin,Action/time,tizanidine
Cefotaxime pill how long before it takes affect,Cefotaxime,Action/time,metoprolol
how do you pronounce Nitrofurantoin,Nitrofurantoin,Pronounce name,Humira
how often is a Cefixime required?,Cefixime,Usage/time,shingles vaccine
what three trade names were gven inthis chapter for this generic drug about Clarithromycin,Clarithromycin,Brand names,hydrochlorothiazide
how long can i take Cefuroxime,Cefuroxime,Usage/time,Miralax
"is it safe to add peppermint essential oil in ""mouth wash?""",Ciprofloxacin,Side effects,peppermint oil
how long on Fosfomycin after vavle replacement surgery,Fosfomycin,Usage/time,metoprolol
what strength dose Azithromycin come in,Azithromycin,Dose,triamcinolone
how long i take cipro for a urinary tract infection ?,Ciprofloxacin,Usage/time,ciprofloxacin
what does the Trimethoprim-sulfamethoxazole pill look like,Trimethoprim-sulfamethoxazole,Appearance,Clotrimazole
how long do opioid withdraws last,Levofloxacin,Information,opioids
is Trimethoprim-sulfamethoxazole chemo.a drug?,Trimethoprim-sulfamethoxazole,Information,Herceptin
what mg is the lowest does of Cefotaxime?,Cefotaxime,Dose,Coreg
what is magnesium chelated good for,Azithromycin,Indication,Chelated magnesium
how much acetaminophen in acetaminophen and codeine,Levofloxacin,Ingredient,acetaminophen + codeine
how do u lower your dosage of Doxycycline,Doxycycline,Stopping/tapering,gabapentin
how does a 20 mcg bedford norton transdermal patch compared to say oxycodone what would be the equivalent,Clarithromycin,Comparison,"oxycodone, fentanyl"
what if Ciprofloxacin does not work,Ciprofloxacin,Alternatives,meclizine
how long keep patient on Nitrofurantoin,Nitrofurantoin,Usage/time,Chantix
what drug will cause frequent urination?,Cefixime,Action,drugs that cause urination
has Fosfomycin been taken off the market?,Fosfomycin,Availability,Lisinopril
"what color are the pills for levodopa carbidopa for ""50/200"" mg extended relief",Cefuroxime,Appearance,"Carbidopa and Levodopa, extended release"
how long do the side effects last after taking Amoxicillin,Amoxicillin,Time/side effects,Medroxyprogesterone
how is Levofloxacin classified,Levofloxacin,Information,Guanfacine
hyptotension Doxycycline?,Doxycycline,Side effects,Lexapro
how to pronounce Azithromycin,Azithromycin,Pronounce name,Chlordiazepoxide
how do you take Ciprofloxacin,Ciprofloxacin,Usage,Clindamycin
mix salt and Trimethoprim-sulfamethoxazole what will happen,Trimethoprim-sulfamethoxazole,Interaction,Hydromorphone
what pill is close to the pill Amoxicillin for bloating food to more faster,Amoxicillin,Alternatives,Hyoscyamine
drugs which stimulating brain ?,Clarithromycin,Action,n/a (Exploration)
what types of insulin for resistance,Cefuroxime,Information,n/a (Exploration)
is Cefotaxime additive?,Cefotaxime,Information,Restoril
how strong is 360 mg Nitrofurantoin,Nitrofurantoin,Dose/Potency,Diltiazem
what is the difference between vitamin b12 1000 geltabs and vitamin b12 shots,Cefixime,Comparison,Cobalamin
what does Fosfomycin 25 mg pill look like,Fosfomycin,Appearance,Spironolactone
what if i eat grapefruit on Nitrofurantoin,Nitrofurantoin,Interaction,Simvastatin
is Clarithromycin gluten free?,Clarithromycin,Ingredient,Losartan
"do i take a Cefotaxime with or without food ""?""",Cefotaxime,Usage,Statin
tdap (adacel) 10-64 yrs how often is booster needed,Fosfomycin,Dose,Adacel Tdap
how long does it take Cefuroxime to work,Cefuroxime,Time/duration,Cefuroxime Axetil
marijuana how long to steam your system,Ciprofloxacin,Time/duration,Tetrahydrocannabinol
do antibiotics like Levofloxacin continue working after cessation of drug ?,Levofloxacin,Time/duration,Keflex
"what is the survival rate of opdivo ""&"" yervoy combo treatments",Doxycycline,Action/effectiveness,Opdivo and Yervoy
how many milligrams in Trimethoprim-sulfamethoxazole,Trimethoprim-sulfamethoxazole,Dose,Tramadol
pain medication how to use,Amoxicillin,Usage,Pain Medications
freezing Cefixime?,Cefixime,Storage and disposal,Clotrimazole
what does it look like/metoprolol,Azithromycin,Appearance,Metroprolol succinate
is it ok to take a probiotic when taking an antibiotic?,Cefuroxime,Interaction,Antibiotics
"how to use ivermectin ""derm gard"" for dog",Trimethoprim-sulfamethoxazole,Usage,Dermgard
can i take meloxicam along with tylenol + cod?,Levofloxacin,Interaction,"Meloxicam, Tylenol and Codeine"
what foods should a person taking Clarithromycin eat,Clarithromycin,Interaction,Warfarin
can i take doxepin and prexum together?,Cefixime,Interaction,"Doxepin, Prexum"
what Nitrofurantoin pills look like,Nitrofurantoin,Appearance,Tramadol
what are contraindications for Azithromycin,Azithromycin,Contraindication,Kadian
how long is Cefotaxime expired,Cefotaxime,Storage and disposal,Oxycodone
what is acebutolol hcl blue pill,Amoxicillin,Information,Acebutolol Hydrochloride
drug therapyof gastritis when taking Fosfomycin sodium,Fosfomycin,Side effects,Diclofenac
who administers Ciprofloxacin?,Ciprofloxacin,Usage,Succinylcholine
does Doxycycline aggravate hepatitis?,Doxycycline,Side effects,Benazepril
what type if medicine is pots chloride 10meq er cap pad,Cefuroxime,Action,Potassium Chloride
Trimethoprim-sulfamethoxazole how long do you use the drops,Trimethoprim-sulfamethoxazole,Usage/time,Latanoprost Ophthalmic
how long does Cefuroxime stay in the urine,Cefuroxime,Time/duration,Oxycontin
what is insulin and glycogen,Nitrofurantoin,Information,"Insulin, Glycogen"
how Doxycycline affects in the process of homeostasis,Doxycycline,Action,Xarelto
"Azithromycin for ""afib what"" are side effects",Azithromycin,Side effects,Amiodarone
how to combine dapaliflozin with metformin,Levofloxacin,Combination,"Dapagliflozin, Metformin"
why Clarithromycin used,Clarithromycin,Indication,Prozac
pill form Ciprofloxacin what does it look like,Ciprofloxacin,Appearance,topamax
what to use with someone in place of Amoxicillin or iodine allergies,Amoxicillin,Alternatives,Morphine
what to use with someone in place of morphine or Fosfomycin allergies,Fosfomycin,Alternatives,iodine
do ursodiol and coconut oil mix?,Cefotaxime,Interaction,Urosodiol
why would my urine test be negative for benzodiazepines when i take Cefixime,Cefixime,other_drug_question,Ativan
can i drink cataflam when i drink medrol;,Amoxicillin,Interaction,"Cataflam, Medrol"
how much pain rellief is in Azithromycin?,Azithromycin,Action/effectiveness,Fentanyl
what is dosage/Cefotaxime,Cefotaxime,Dose,Quetiapine
one dose amoxicillin how many capsule,Cefixime,Dose,Amoxiciliin
what happens if too much Levofloxacin is released into the blood,Levofloxacin,Overdose,Insulin
what type of drug is Clarithromycin,Clarithromycin,Information,Amphetamine
blood pressure when on eliquis metropropnal,Cefuroxime,Interaction,"Eliquis, Metoprolol"
age limits for use of Ciprofloxacin?,Ciprofloxacin,Indication,Bupropion
how to self inject enoxaparin sodium,Doxycycline,Usage,Enoxparin Sodium
how much is 5ml in Fosfomycin?,Fosfomycin,Dose,Cough Syrup
how to come off Trimethoprim-sulfamethoxazole,Trimethoprim-sulfamethoxazole,Stopping/tapering,Citalopram
what type of drug is Nitrofurantoin,Nitrofurantoin,Information,Heroin
wetting in pants after Fosfomycin shot?,Fosfomycin,Side effects,Penicillin
how to inject Azithromycin,Azithromycin,Usage,Insulin
what to do if missed two days of Doxycycline,Doxycycline,Forget a dose,Thyroid medications
what is a Trimethoprim-sulfamethoxazole,Trimethoprim-sulfamethoxazole,Information,Biologic
how to stop taking Cefuroxime,Cefuroxime,Stopping/tapering,Amlodipine
what color is 30mg Levofloxacin,Levofloxacin,Appearance,Prednisone
how to use Nitrofurantoin in malaria,Nitrofurantoin,Indication,Ceftriaxone
what his acetaminophen and 8mg phosphate codeline,Ciprofloxacin,Combination,"Acetaminophen, Codeine Phosphate"
do i take a Cefotaxime with or without food ?,Cefotaxime,Usage,Statin
what is Amoxicillin,Amoxicillin,Information,Aldosterone
"why no side affects on Clarithromycin listed, yet on reg inet they have a list?",Clarithromycin,Side effects,Hydromorphone
when you stop taking Cefixime do you bleed,Cefixime,Stopping/tapering,Spironolactone
how many Cefixime aday,Cefixime,Dose,Tums
remipril compatible with cabergoline?,Ciprofloxacin,Interaction,"Ramipril, Cabergoline"
what happens when you take Levofloxacin long term,Levofloxacin,Side effects,Lansoprazole
"how much ethanol alcohol is in 2 puffs of ""proair?""",Nitrofurantoin,Ingredient,ProAir HFA
can clots still occur when taking Trimethoprim-sulfamethoxazole,Trimethoprim-sulfamethoxazole,Action/effectiveness,Rivaroxaban
how often should you get a zoster vaccine,Amoxicillin,Dose/time,Herpes zoster vaccine
what insulin can be mixed with glargine,Azithromycin,Combination,"Glargine, Insulin"
what is Doxycycline used for,Doxycycline,Indication,Naproxen
taken off this medicine / how might it affect me? Clarithromycin?,Clarithromycin,Stopping/tapering,Palmarosa
how does amitriptyline compare to alprazolam,Cefotaxime,Comparison,"Amitriptyline, Alprazolam"
what is Cefuroxime used for,Cefuroxime,Indication,Aldactazide
how does Fosfomycin work?,Fosfomycin,Action,Insulin
how to use Nitrofurantoin oral inhalation demonstration video,Nitrofurantoin,Usage,Albuterol
gabapentin and pregabalin what is the difference?,Doxycycline,Comparison,"Gabapentin, Pregabalin"
why is Amoxicillin prescribed,Amoxicillin,Indication,Pyridostigmine
what is highest dose of Azithromycin a person can take,Azithromycin,Dose,Oxybutynin
what is brand name of acetaminophen,Clarithromycin,Brand names,"Acetaminophen, Codeine Phosphate"
ink 2.3 how much Levofloxacin should one take,Levofloxacin,Dose,Coumadine
how does Cefuroxime work,Cefuroxime,Action,Spiriva
Cefixime and depression?,Cefixime,Side effects,Norvasc
how many days after taking the pill with i start my period,Trimethoprim-sulfamethoxazole,Action,Birth Control Pills
how often zoster zoster vaccine needs to be taken,Cefotaxime,Dose/time,Herpes zoster vaccine
what is Fosfomycin,Fosfomycin,Information,Bioflavonoid
what are the symptoms of a human exposed to Ciprofloxacin,Ciprofloxacin,Side effects,Boric Acid Powder
dtap/tdap/td vaccines how often is this due,Trimethoprim-sulfamethoxazole,Dose,"DTaP, Tdap, Td"
who makes this drug nitrofurantoin ?,Nitrofurantoin,Manufacturer,Nitrofurantoin
what is a daily amount of prednisolone eye drops to take,Cefotaxime,Dose,Predinsolone acetate suspension
is lyrica the same as gabbentine?,Doxycycline,Comparison,"Gabapentin, Pregabalin"
how long it takes for withdrawals to go away on Ciprofloxacin,Ciprofloxacin,Information,Oxycodone
what is a safe dosage for Azithromycin?,Azithromycin,Dose,gabapentin
seniors and Fosfomycin?,Fosfomycin,Usage,premarin
can Cefixime products be used with other over-the-counter (otc) or prescription medications?,Cefixime,Interaction,mucinex fast-max
how Nitrofurantoin reduce pain,Nitrofurantoin,Action,opioids
how to stop taking Levofloxacin,Levofloxacin,Stopping/tapering,buprenorphine
what is the side effect of bp medicine on brain?,Amoxicillin,Side effects,blood pressure medicine
Cefuroxime 40mcg what is it for,Cefuroxime,Indication,qvar
"Clarithromycin ""patch,"" what if ""doesn't"" stick well",Clarithromycin,Usage,fentanyl
what size pill is Doxycycline,Doxycycline,Appearance,risedronate
what is in the pill Clarithromycin?,Clarithromycin,Ingredient,montelukast
what meds are in the pill Azithromycin?,Azithromycin,Ingredient,montelukast
how often do you take Nitrofurantoin?,Nitrofurantoin,Usage/time,flu vaccine
hyptotension caused by Fosfomycin?,Fosfomycin,Side effects,lexapro
how to safely stop fluvoxamine malate,Cefixime,Stopping/tapering,fluvoxamine maleate
Cefotaxime tablets 10 mg is for what purpose,Cefotaxime,Indication,dydrogesterone
how often do you need a Trimethoprim-sulfamethoxazole,Trimethoprim-sulfamethoxazole,Usage/time,shingles vaccine
how often do you need a Amoxicillin,Amoxicillin,Usage/time,shingles vaccine
when is the best tme to take Ciprofloxacin tab.,Ciprofloxacin,Usage,magnesium citrate
why did my doctor give me Cefuroxime,Cefuroxime,Indication,levetiracetam
Levofloxacin made by unichem is it safe?,Levofloxacin,Side effects,hydrochlorothiazide
how to use Cefixime,Cefixime,Usage,spiriva
how often should you use a Levofloxacin inhaler,Levofloxacin,Usage/time,dulera
what exactly is Clarithromycin,Clarithromycin,Information,butalbital
Cefuroxime over counter?,Cefuroxime,Information,testosterone
what are Cefotaxime,Cefotaxime,Information,beta blockers
is Azithromycin a treament for cor pulmonale?,Azithromycin,Indication,Viagra
is Trimethoprim-sulfamethoxazole the only diuretic drug for fluid build up in heart failure patients?,Trimethoprim-sulfamethoxazole,Indication,Lasix
is lasix the only Nitrofurantoin in heart failure patients?,Nitrofurantoin,Indication,diuretic drug for fluid build up
what can i do if unusual bruising appears after injecting Doxycycline,Doxycycline,Side effects,enoxaparin
what effect if take high cholesteron pill,Fosfomycin,Action,high cholesterol medication
will anti viral drugs activate my angio edema condition?,Amoxicillin,Side effects,antiviral drugs
what is the length of Ciprofloxacin treatment,Ciprofloxacin,Usage/duration,entecavir
how fast does teh medications take to work Cefotaxime,Cefotaxime,Action/time,amlodipine
are tobacco and Doxycycline products addictive?,Doxycycline,Side effects,nicotine
how does Clarithromycin affect creatine,Clarithromycin,Side effects,Sutent
how long does Trimethoprim-sulfamethoxazole stay in toxicology test,Trimethoprim-sulfamethoxazole,Action/time,heroin
how dangerous is cutting Azithromycin cc tablets,Azithromycin,Usage,nifedipine ER
what is the normal dose of Amoxicillin,Amoxicillin,Dose,clindamycin
how do you pronounce Ciprofloxacin,Ciprofloxacin,Pronounce name,prednisolone
how to administer Nitrofurantoin,Nitrofurantoin,Usage,insulin
what dosage amounts does Cefuroxime,Cefuroxime,Dose,aripiprazole
how long does ecstasy or mda leave your body,Levofloxacin,Action/time,ecstacy
can spironolactone e used when talking furosemide,Cefixime,Interaction,spironolactone + furosemide
how long should i take Fosfomycin,Fosfomycin,Usage/duration,dutasteride
what is in Cefixime,Cefixime,Ingredient,norvasc
how soon does Fosfomycin afffect blood pressure,Fosfomycin,Action/time,losartan
Nitrofurantoin is what schedule drug,Nitrofurantoin,Information,Tudorza Pressair
should metoprolol and lexapro be taken together?,Doxycycline,Interaction,metoprolol + Lexapro
what shape is the Trimethoprim-sulfamethoxazole pill,Trimethoprim-sulfamethoxazole,Appearance,amlodipine
is Amoxicillin marijuana how much are ten mg pills worth,Amoxicillin,not_drug_question,dronabinol
is Azithromycin marijuana how much are ten mg pills worth,Azithromycin,not_drug_question,dronabinol
how to wean off Cefotaxime,Cefotaxime,Stopping/tapering,Calan SR
what does Clarithromycin look like,Clarithromycin,Appearance,memantine
what does Levofloxacin look like,Levofloxacin,Appearance,memantine
what does Ciprofloxacin look like,Ciprofloxacin,Appearance,memantine
what does Cefuroxime look like,Cefuroxime,Appearance,memantine
what happens if your child ate a Cefuroxime tablet,Cefuroxime,Overdose,tylenol
where is Cefotaxime originated from,Cefotaxime,Information,heroin
Trimethoprim-sulfamethoxazole >65what is this vaccine ?,Trimethoprim-sulfamethoxazole,Information,prevnar
what medications contribute to non-alcoholic fatty liver,Nitrofurantoin,Side effects,medications that contribute to non-alcoholic fatty liver
"what mg does Azithromycin come ""in?""",Azithromycin,Dose,lunesta
what is Clarithromycin,Clarithromycin,Information,fentanyl
what is the reason for having to use Levofloxacin after a antibodies fusion,Levofloxacin,Indication,heparin
"Doxycycline , is it necessary to get a 2nd shot?",Doxycycline,Usage/time,shingles vaccine
"Amoxicillin , is it necessary to get a 2nd shot?",Amoxicillin,Usage/time,shingles vaccine
what drugs case erectile dysfuntion,Ciprofloxacin,Side effects,drugs that cause erectile dysfunction
how long does it take to get carbidopa levodopa out of your system,Cefixime,Action/time,carbidopa and levodopa
it is Fosfomycin a cholinergic?,Fosfomycin,Information,latanoprost
can you take Ciprofloxacin ?,Ciprofloxacin,Interaction,tamsulosin and ciprofloxacin
can i drink voltarel or cataflam when i drink medrol,Amoxicillin,Interaction,(Voltaren or Cataflam) and Medrol
"is Clarithromycin an ""opioid?""",Clarithromycin,Ingredient,oxybutynin
in how much temp Ciprofloxacin should store,Ciprofloxacin,Storage and disposal,bcg vaccine
how can Nitrofurantoin effect my blood test,Nitrofurantoin,Side effects,biotin
Cefuroxime how often?,Cefuroxime,Usage/time,pneumococcal vaccine
Azithromycin how often?,Azithromycin,Usage/time,pneumococcal vaccine
how to give diazepam rectal gel,Fosfomycin,Usage,diazepam gel
is there an antacid Doxycycline?,Doxycycline,Information,malox
what is Cefixime,Cefixime,Information,pepsin
if i am allergic to sufa can i take Levofloxacin?,Levofloxacin,Contraindication,glipizide
what color is Cefotaxime,Cefotaxime,Appearance,phenytoin
what color is Trimethoprim-sulfamethoxazole,Trimethoprim-sulfamethoxazole,Appearance,phenytoin
what color is Cefixime,Cefixime,Appearance,phenytoin
what color is Clarithromycin,Clarithromycin,Appearance,phenytoin
what are the ingredients in the drug Ciprofloxacin,Ciprofloxacin,Ingredient,methimazole
what is Cefuroxime,Cefuroxime,Information,xanax
how long should you use Amoxicillin,Amoxicillin,Usage/duration,anti inflammatory gel
what does hydro coding acet 5-325,Fosfomycin,Information,hydrocodone + acetaminophen
how is Azithromycin metabolized?,Azithromycin,Action,tetracycline
what do Nitrofurantoins look like,Nitrofurantoin,Appearance,percocet
"how long is mda or ecstasy take to leave your ""body?""",Cefotaxime,Action/time,ecstacy
how will i feel when taking Levofloxacin tablets,Levofloxacin,Side effects,memantine
how will i feel when taking Doxycycline tablets,Doxycycline,Action,memantine
Trimethoprim-sulfamethoxazole how to use them safely,Trimethoprim-sulfamethoxazole,Usage,blood thinner pills
what is Doxycycline,Doxycycline,Information,coumadin
"what help withdrawal ""fom."" hydrocodone 10 35",Levofloxacin,Stopping/tapering,hydrocodone + acetaminophen
what are the different strenths of Fosfomycin?,Fosfomycin,Dose,dexamethasone
how long can Azithromycin be taken?,Azithromycin,Usage/duration,megestrol
what does Cefotaxime do,Cefotaxime,Action,metformin
can you use Cefixime past expiration date?,Cefixime,Storage and disposal,fluorouracil
what is usual infusion time for Cefuroxime injecetion,Cefuroxime,Usage,cetuximab
what is Amoxicillin,Amoxicillin,Information,streptomycin
what is the drug to drug interation for luvox and quillivant,Clarithromycin,Interaction,Luvox + Quillivant
"albuterol portable ""nebulizer?"" microtia vibrating mesh nebulizing ""system.""",Trimethoprim-sulfamethoxazole,Information,albuterol nebulizers
what if i quit taking Nitrofurantoin,Nitrofurantoin,Stopping/tapering,thyroid medicine
what is the highest dose Ciprofloxacin comes in,Ciprofloxacin,Dose,lidocaine
what drugs contain in testerone injection,Fosfomycin,Information,testosterone injection
