Question,Focus (Drug),Question Type,original_drug
what is in Cefotaxime,Cefotaxime,Ingredient,lidocaine
when taking plavix and xarelto blood thinners is it safe to take dilaudid for pain,Cefuroxime,Interaction,"plavix, xarelto,  dilaudid"
is erythromycin ophthalmic ointment good for inflamed eyelids?,Ciprofloxacin,Indication,erythromycin ointment
how should i dilute Clarithromycin?,Clarithromycin,Usage,ceftriaxone injection
symptoms from taking multiple doses of Amoxicillin 40 mg per dayproblems with taking Amoxicillin 40mg twice daily ?,Amoxicillin,Side effects,lasix
how long for allergic reaction after using Nitrofurantoin,Nitrofurantoin,Side effects/time,nivolumab
where does Amoxicillin come from,Amoxicillin,Information,fluorouracil
where does Nitrofurantoin come from,Nitrofurantoin,Manufacturer,fluorouracil
Clarithromycin how long in system,Clarithromycin,Action/time,chlorpheniramine
how long will 6 mgs of Cefotaxime block opiates,Cefotaxime,Action/time,suboxone
how is Levofloxacin administered,Levofloxacin,Usage,tocilizumab
what is Trimethoprim-sulfamethoxazole ointment used for,Trimethoprim-sulfamethoxazole,Indication,diclofenac
Azithromycin is for what sexual diseases,Azithromycin,Indication,cephalexin
what is Doxycycline,Doxycycline,Information,terfenadine
what is Cefuroxime,Cefuroxime,Information,bisolvon
is it safe for a 72 year old to stop taking Cefixime?,Cefixime,Stopping/tapering,premarin
what are the side effects of taking the two medication amlodipine metoprolol together,Fosfomycin,Interaction,amlodipine; metoprolol
how soon does Ciprofloxacin affect blood pressure,Ciprofloxacin,Action/time,losartan
how do Nitrofurantoin effect the respiratory system,Nitrofurantoin,Action,steroids
why am i so cold taking Azithromycin b p med,Azithromycin,Side effects,bystolic
Cefuroxime how often,Cefuroxime,Usage/time,pneumococcal vaccine
is it alright to use fluticasone when using oxygen,Doxycycline,Interaction,"fluticasone, oxygen"
